{
  "recipe_name": "小黃瓜切片 Demo",
  "current_step_index": 0,
  "ingredients": [
    {"id": "cucumber", "label": "小黃瓜"}
  ],
  "steps": [
    {
      "step_id": 0,
      "instruction": "請將小黃瓜放入畫面",
      "target_ingredient": "cucumber",
      "expected_status": "present",
      "trigger_condition": "target_present",
      "guide_lines": false
    },
    {
      "step_id": 1,
      "instruction": "小黃瓜切為 1 公分薄片（完成按 N / Space）",
      "target_ingredient": "cucumber",
      "expected_status": "sliced",
      "trigger_condition": "manual_confirm",
      "guide_lines": true,
      "cut_spacing_mm": 10,
      "confirm_on_complete": true,
      "checklist_label": "切成 1cm 薄片"
    }
  ]
}
